{
  "schema_version": 1,
  "generated_at": "2026-08-10T23:06:29Z",
  "root": ".",
  "tool": "aurora_mission_control",
  "run_mode": "read_only",
  "mutation_posture": "advisory_only",
  "nested_repo_mutation": false,
  "manifest_path": "catalog/mission_control_manifest.json",
  "status": "blocked",
  "summary": {
    "source_count": 7,
    "source_error_count": 0,
    "operator_inbox_count": 12,
    "blocking_count": 4,
    "approval_required_count": 10,
    "by_priority": {
      "P1": 7,
      "P2": 5
    },
    "by_category": {
      "boundary": 1,
      "developer_tooling": 9,
      "recovery_review": 1,
      "validation": 1
    },
    "by_status": {
      "blocked": 5,
      "open": 7
    },
    "build_lanes": {
      "ready": 0,
      "attention": 0,
      "blocked": 6
    }
  },
  "source_reports": {
    "project_focus": {
      "status": "active",
      "announcement_count": 1,
      "active_count": 1
    },
    "workspace_verify": {
      "status": "warn",
      "finding_count": 2,
      "blocking_count": 0
    },
    "integration_gate": {
      "status": "pass",
      "check_count": 5,
      "command_count": 0
    },
    "recovery_index": {
      "status": "READY",
      "candidate_count": 100,
      "discovered_candidate_count": 1081,
      "restricted_candidate_count": 33
    },
    "devkit": {
      "status": "BLOCKED",
      "tools_ok": 8,
      "tools_total": 21,
      "finding_count": 15,
      "install_plan_items": 13
    },
    "recommendations": {
      "status": "open",
      "recommendation_count": 24,
      "blocking_count": 4,
      "approval_required_count": 21
    },
    "git_status": {
      "status": "dirty",
      "changed_path_count": 7,
      "branch": "main...origin/main"
    }
  },
  "build_lanes": [
    {
      "lane_id": "root-python-control-tools",
      "title": "Root Python control-plane tooling",
      "status": "blocked",
      "required_tools": [
        "python3",
        "uv",
        "sqlite3"
      ],
      "recommended_tools": [
        "pre-commit",
        "ruff",
        "mypy"
      ],
      "missing_required_tools": [
        "sqlite3"
      ],
      "missing_recommended_tools": [
        "pre-commit",
        "ruff",
        "mypy"
      ],
      "next_action": "Use this lane for root CLIs, report generators, validators, and receipt tooling.",
      "evidence_refs": [
        "reports/analysis/aurora_devkit_latest.json"
      ],
      "mutation_posture": "readiness_only"
    },
    {
      "lane_id": "frontend-dashboard",
      "title": "Local frontend dashboard",
      "status": "blocked",
      "required_tools": [
        "node",
        "npm",
        "corepack",
        "pnpm"
      ],
      "recommended_tools": [],
      "missing_required_tools": [
        "pnpm"
      ],
      "missing_recommended_tools": [],
      "next_action": "Use this lane for a localhost-only Vite dashboard after a CLI/report contract is stable.",
      "evidence_refs": [
        "reports/analysis/aurora_devkit_latest.json"
      ],
      "mutation_posture": "readiness_only"
    },
    {
      "lane_id": "containerized-services",
      "title": "Containerized local services",
      "status": "blocked",
      "required_tools": [
        "docker"
      ],
      "recommended_tools": [],
      "missing_required_tools": [
        "docker"
      ],
      "missing_recommended_tools": [],
      "next_action": "Use this lane for devcontainers and reproducible local service stacks.",
      "evidence_refs": [
        "reports/analysis/aurora_devkit_latest.json"
      ],
      "mutation_posture": "readiness_only"
    },
    {
      "lane_id": "apple-platforms",
      "title": "Apple platform build checks",
      "status": "blocked",
      "required_tools": [
        "xcodebuild"
      ],
      "recommended_tools": [],
      "missing_required_tools": [
        "xcodebuild"
      ],
      "missing_recommended_tools": [],
      "next_action": "Use this lane for macOS/iOS feasibility checks and simulator-backed validation.",
      "evidence_refs": [
        "reports/analysis/aurora_devkit_latest.json"
      ],
      "mutation_posture": "readiness_only"
    },
    {
      "lane_id": "systems-tools",
      "title": "Systems helper tooling",
      "status": "blocked",
      "required_tools": [
        "rust",
        "go"
      ],
      "recommended_tools": [],
      "missing_required_tools": [
        "rust",
        "go"
      ],
      "missing_recommended_tools": [],
      "next_action": "Use this lane for high-performance local helpers only after a root contract exists.",
      "evidence_refs": [
        "reports/analysis/aurora_devkit_latest.json"
      ],
      "mutation_posture": "readiness_only"
    },
    {
      "lane_id": "github-maintenance",
      "title": "GitHub maintenance and CI triage",
      "status": "blocked",
      "required_tools": [
        "git",
        "gh"
      ],
      "recommended_tools": [],
      "missing_required_tools": [
        "gh"
      ],
      "missing_recommended_tools": [],
      "next_action": "Use this lane for root or explicitly named nested-repo PR/issue/CI workflows.",
      "evidence_refs": [
        "reports/analysis/aurora_devkit_latest.json"
      ],
      "mutation_posture": "readiness_only"
    }
  ],
  "operator_inbox": [
    {
      "item_id": "mission-p1-devkit-developer_tooling-gh-is-missing",
      "title": "gh is missing.",
      "category": "developer_tooling",
      "priority": "P1",
      "source": "devkit",
      "target_repo": "root",
      "owner_surface": "root control-plane repo",
      "evidence_refs": [
        "catalog/dev_toolkit_manifest.json::tool_gh_missing"
      ],
      "recommended_next_action": "Required for GitHub PR, issue, and CI maintenance.",
      "suggested_commands": [
        "brew install gh",
        "brew upgrade gh"
      ],
      "approval_required": true,
      "mutation_posture": "advisory_only",
      "blocking": true,
      "status": "blocked"
    },
    {
      "item_id": "mission-p1-devkit-developer_tooling-sqlite3-is-missing",
      "title": "sqlite3 is missing.",
      "category": "developer_tooling",
      "priority": "P1",
      "source": "devkit",
      "target_repo": "root",
      "owner_surface": "root control-plane repo",
      "evidence_refs": [
        "catalog/dev_toolkit_manifest.json::tool_sqlite3_missing"
      ],
      "recommended_next_action": "Useful for local indexes, receipts, and lightweight metadata stores.",
      "suggested_commands": [
        "brew install sqlite",
        "brew upgrade sqlite"
      ],
      "approval_required": true,
      "mutation_posture": "advisory_only",
      "blocking": true,
      "status": "blocked"
    },
    {
      "item_id": "mission-p1-devkit-developer_tooling-aurora-cloudbank-symbolic-main-python-environment-is-blocked",
      "title": "aurora-cloudbank-symbolic-main Python environment is blocked.",
      "category": "developer_tooling",
      "priority": "P1",
      "source": "devkit",
      "target_repo": "root",
      "owner_surface": "root control-plane repo",
      "evidence_refs": [
        "catalog/dev_toolkit_manifest.json::repo_python_env_aurora-cloudbank-symbolic-main_blocked"
      ],
      "recommended_next_action": "CloudBank validation must use the repo-local .venv interpreter. Plain root/system python3 is not the CloudBank runtime environment.",
      "suggested_commands": [
        "python3 tools/aurora_devkit.py --install-plan"
      ],
      "approval_required": true,
      "mutation_posture": "advisory_only",
      "blocking": true,
      "status": "open"
    },
    {
      "item_id": "mission-p1-devkit-developer_tooling-python3-12-is-missing",
      "title": "python3.12 is missing.",
      "category": "developer_tooling",
      "priority": "P1",
      "source": "devkit",
      "target_repo": "root",
      "owner_surface": "root control-plane repo",
      "evidence_refs": [
        "catalog/dev_toolkit_manifest.json::tool_python3.12_missing"
      ],
      "recommended_next_action": "Canonical Python floor (declared in .python-version). Required for CloudBank venv compatibility and CI parity. CI gates merges on 3.12. Install via: uv python install 3.12",
      "suggested_commands": [
        "python3 tools/aurora_devkit.py --install-plan"
      ],
      "approval_required": true,
      "mutation_posture": "advisory_only",
      "blocking": true,
      "status": "open"
    },
    {
      "item_id": "mission-p1-workspace_verify-boundary-resolve-workspace-verifier-finding-repo-registry-coverage",
      "title": "Resolve workspace verifier finding: repo_registry_coverage",
      "category": "boundary",
      "priority": "P1",
      "source": "workspace_verify",
      "target_repo": "root",
      "owner_surface": "root control-plane repo",
      "evidence_refs": [
        "tools/workspace_verify.py::repo_registry_coverage"
      ],
      "recommended_next_action": "Run from the canonical workspace path or update `catalog/repo_registry.yaml` if the repo locations changed.",
      "suggested_commands": [
        "python3 tools/workspace_verify.py"
      ],
      "approval_required": false,
      "mutation_posture": "advisory_only",
      "blocking": false,
      "status": "open"
    },
    {
      "item_id": "mission-p1-recovery_index-recovery_review-review-3-restricted-recovery-candidates-carefully",
      "title": "Review 3 restricted recovery candidates carefully",
      "category": "recovery_review",
      "priority": "P1",
      "source": "recovery_index",
      "target_repo": "root",
      "owner_surface": "root control-plane repo",
      "evidence_refs": [
        "reports/analysis/workspace_recovery_index_latest.json::restricted_recovery_candidates_metadata"
      ],
      "recommended_next_action": "Handle restricted candidates through a separate review decision; do not copy them into issues, PRs, or canon surfaces by default.",
      "suggested_commands": [
        "python3 tools/workspace_recovery_index.py --summary"